"conversation_id_str","created_at","favorite_count","full_text","id_str","image_url","in_reply_to_screen_name","lang","location","quote_count","reply_count","retweet_count","tweet_url","user_id_str","username"
"1951059503904071925","Thu Jul 31 23:16:49 +0000 2025","0","Semangat mamang gojek mmf kalau lokasi ak jauh bbgt https://t.co/BIONq4CVye","1951059503904071925","https://pbs.twimg.com/media/GxOOR2WaIAAQWvY.jpg","","in","","0","0","0","https://x.com/undefined/status/1951059503904071925","1428215486353870850",
"1951058918689677413","Thu Jul 31 23:14:29 +0000 2025","0","️ YUHUU BACA DULU YA GES ️ WTS VOC GORIDE pot 5k fee 500 GOCAR pot 12k fee 1.5k - BISA SEMUA DOMISILI ‼️ - kalau ga jadi bilang ‼️ - GOPAY / TUNAI AJA ‼️ wts wtb voc goride krl gojek gocar #zonauang️ https://t.co/vyXO72IpCW","1951058918689677413","https://pbs.twimg.com/media/GxONuruaQAAvOeY.jpg","","in","","0","1","0","https://x.com/undefined/status/1951058918689677413","1359300973596798977",
"1951058391096496218","Thu Jul 31 23:12:24 +0000 2025","0","wtb voucher gojek #zonauang #zonaba","1951058391096496218","","","in","","0","2","0","https://x.com/undefined/status/1951058391096496218","1714084739559395328",
"1951058114897392010","Thu Jul 31 23:11:18 +0000 2025","0","... ... Kita dijajah lagi sama jepang? www Jepang dulu jahat sih tp prabowo juga hobi ngajak warga gelut. Nakama surabaya tidur kah kok aku belum liat bendera one piece berkibar? [Di tokopedia bnyk tp mending beli bendera merah putih guys] PS: Aku bukan antek asing.","1951058114897392010","","","in","","0","0","0","https://x.com/undefined/status/1951058114897392010","59001709",
"1951057623790579960","Thu Jul 31 23:09:21 +0000 2025","0","Coba cek ini di Tokopedia deh. Harganya Rp70.800 https://t.co/4vfkocn2gl https://t.co/eOjqboPMf9","1951057623790579960","https://pbs.twimg.com/media/GxOMkVaacAAFHJz.jpg","","in","","0","0","0","https://x.com/undefined/status/1951057623790579960","553597820",
"1951057543675126014","Thu Jul 31 23:09:01 +0000 2025","0","Coba cek ini di Tokopedia deh. Harganya Rp100.300 https://t.co/8ElTtfcYhW https://t.co/yq7IeB2Bgh","1951057543675126014","https://pbs.twimg.com/media/GxOMfxXaIAE4Xya.jpg","","in","","0","0","0","https://x.com/undefined/status/1951057543675126014","553597820",
"1951054425646309844","Thu Jul 31 22:59:37 +0000 2025","0","@Morriyxy naik gojek atau apaa","1951055174665109620","","Morriyxy","in","","0","1","0","https://x.com/undefined/status/1951055174665109620","1558678489771155457",
"1951055168252027113","Thu Jul 31 22:59:35 +0000 2025","0","Coba cek ini di Tokopedia deh. Harganya Rp110.000 https://t.co/D7Xb3aA6Mp https://t.co/R69VCzRK1y","1951055168252027113","https://pbs.twimg.com/media/GxOKVe9acAAsZuV.jpg","","in","","0","0","0","https://x.com/undefined/status/1951055168252027113","1301200440248291328",
"1951054639421428147","Thu Jul 31 22:57:29 +0000 2025","0","DEODORANT KAHF Coba lihat produk ini! https://t.co/OIWaB4dZnz","1951054639421428147","","","in","","0","0","0","https://x.com/undefined/status/1951054639421428147","1283598079275327488",
"1951054512644563042","Thu Jul 31 22:56:59 +0000 2025","0","Makarizo Hair Energy Fibertherapy Hair &amp; Scalp Creambath Royal Jelly 500 mL / Perawatan Rambut Kering / Haircare / Vitamin https://t.co/tacy65duzT","1951054512644563042","","","in","","0","0","0","https://x.com/undefined/status/1951054512644563042","62197539",
"1951047986181710017","Thu Jul 31 22:56:46 +0000 2025","0","@Nyimakajja Kaget tiba tiba makin kepinggir aja ni gojek ternyata ngantuk bjir","1951054458206691390","","Nyimakajja","in","","0","0","0","https://x.com/undefined/status/1951054458206691390","1782392484586463232",
"1951054454024999398","Thu Jul 31 22:56:45 +0000 2025","0","sabun viral Coba lihat produk ini! https://t.co/K9DZppPAK2","1951054454024999398","","","in","","0","0","0","https://x.com/undefined/status/1951054454024999398","1283598079275327488",
"1951054188214948195","Thu Jul 31 22:55:41 +0000 2025","0","HAOCEK SUPLEMEN SEHAT Coba lihat produk ini! https://t.co/wTIwmDHjsY","1951054188214948195","","","in","","0","0","0","https://x.com/undefined/status/1951054188214948195","1283598079275327488",
"1951053029475754284","Thu Jul 31 22:51:05 +0000 2025","0","Langsung dikirim. Stok baru. Gratis ongkir. Mumpung #JumatBerkah Bantu larisin yuk. Terima kasih repost. Order 1 Bks sangat dihargai. Terima kasih https://t.co/aZlfNzE39r","1951053029475754284","","","in","","0","1","1","https://x.com/undefined/status/1951053029475754284","146365198",
"1951052890489201090","Thu Jul 31 22:50:32 +0000 2025","0","HARVA Shampoo Ginseng Soft &amp; Smooth 600ML | Haircare Sampoo Sekaligus Conditioner Rambut Rontok Serta Menutrisi Rambut https://t.co/Vtjh1DWv3F","1951052890489201090","","","in","","0","0","0","https://x.com/undefined/status/1951052890489201090","794483431539286016",
"1951051518192525482","Thu Jul 31 22:45:05 +0000 2025","0","nokos gojek yg bisa verif skrg dong #zonauang #zonabaᅠᅠᅠ","1951051518192525482","","","in","","0","7","0","https://x.com/undefined/status/1951051518192525482","1517406930402037760",
"1951050572196618280","Thu Jul 31 22:41:19 +0000 2025","0","Coba lihat produk ini! https://t.co/FAYVmkpX7E","1951050572196618280","","","in","","0","0","0","https://x.com/undefined/status/1951050572196618280","198830994",
"1951050456601641337","Thu Jul 31 22:40:52 +0000 2025","0","Coba lihat produk ini! https://t.co/OBgbIGUf2A","1951050456601641337","","","in","","0","0","0","https://x.com/undefined/status/1951050456601641337","198830994",
"1951050379447378360","Thu Jul 31 22:40:33 +0000 2025","0","Coba lihat produk ini! https://t.co/OWRM6Ob8tG","1951050379447378360","","","in","","0","0","0","https://x.com/undefined/status/1951050379447378360","198830994",
"1951050218302218696","Thu Jul 31 22:39:55 +0000 2025","0","Coba lihat produk ini! https://t.co/u4B1zrZelt","1951050218302218696","","","in","","0","0","0","https://x.com/undefined/status/1951050218302218696","198830994",
"1951050141210960307","Thu Jul 31 22:39:37 +0000 2025","0","Coba lihat produk ini! https://t.co/EU6XTKcU8y","1951050141210960307","","","in","","0","0","0","https://x.com/undefined/status/1951050141210960307","198830994",
"1951050072139206743","Thu Jul 31 22:39:20 +0000 2025","0","Coba lihat produk ini! https://t.co/GRslbViJCJ","1951050072139206743","","","in","","0","0","0","https://x.com/undefined/status/1951050072139206743","198830994",
"1951049672178671778","Thu Jul 31 22:37:45 +0000 2025","0","(Glowby) Perfect Glowing 1 Sabun dan Serum Lotion Bayi dan Anak https://t.co/SZceW73z8j","1951049672178671778","","","in","","0","0","0","https://x.com/undefined/status/1951049672178671778","198830994",
"1951049181218611269","Thu Jul 31 22:35:48 +0000 2025","0","(Exclusive Glowby X Jedar El) Bundling Skin Serum dan Hair Lotion Mencerahkan dan Melebatkan Rambut Bayi dan Anak https://t.co/FnX0t7XTwS","1951049181218611269","","","in","","0","0","0","https://x.com/undefined/status/1951049181218611269","198830994",
"1951049157457609212","Thu Jul 31 22:35:42 +0000 2025","0","JENNA Blazer Outer x MSD-Blazer outer hijab katun linen flowy korean Style kerja casual Nyaman Santai Tangan Panjang Wanita https://t.co/RXzaXfCd7X","1951049157457609212","","","in","","0","0","0","https://x.com/undefined/status/1951049157457609212","82666759",
"1951047986181710017","Thu Jul 31 22:31:03 +0000 2025","0","Bangke bangke sengaja gamau ngobrol sama gojek malah dianya yang ngantuk jir. Terpaksa ngobrol sampe tujuan ","1951047986181710017","","","in","","0","2","0","https://x.com/undefined/status/1951047986181710017","1782392484586463232",
"1951047876777484794","Thu Jul 31 22:30:37 +0000 2025","0","Polresta Bogor Kota berhasil mengamankan salah satu pelaku pengeroyokan yang menyebabkan luka tusukan terhadap seorang remaja di kawasan Shelter Gojek depan Mall Botani Square Kelurahan Tegallega Kecamatan Bogor Tengah Kamis (31/7/2025) sekitar pukul 18.00 WIB. https://t.co/jOSJdObHBp","1951047876777484794","https://pbs.twimg.com/amplify_video_thumb/1951047772888768513/img/MEaSbTD7VAD7Pfr7.jpg","","in","","0","1","0","https://x.com/undefined/status/1951047876777484794","337552830",
"1951047240254132332","Thu Jul 31 22:28:05 +0000 2025","0","BOSS Celana Panjang Formal Pria Regular Fit HT Hitam https://t.co/JD1g6zDgb6","1951047240254132332","","","in","","0","0","0","https://x.com/undefined/status/1951047240254132332","256407664",
"1951046988599799839","Thu Jul 31 22:27:05 +0000 2025","0","Hada Labo Gokujyun Face Wash 100g https://t.co/trvIZ1AWR8","1951046988599799839","","","in","","0","0","0","https://x.com/undefined/status/1951046988599799839","256407664",
"1951046580599136611","Thu Jul 31 22:25:28 +0000 2025","0","BELINYA DISINI YA.. Bendera Merah Putih Bahan Katun Tebal Full Ukuran 90x60 150x100 120x80 180x120 Pilihan Ukuran Sesuai Kebutuhan Anda Kain https://t.co/X0P21ykF47","1951046580599136611","","","in","","0","0","0","https://x.com/undefined/status/1951046580599136611","1890680669229178880",
"1951046377326379502","Thu Jul 31 22:24:39 +0000 2025","0","BELINYA DISINI YA.. Bendera Merah Putih 100x170cm Bahan Satin Peles https://t.co/MwGwb306If","1951046377326379502","","","in","","0","0","0","https://x.com/undefined/status/1951046377326379502","1890680669229178880",
"1951045908470309350","Thu Jul 31 22:22:47 +0000 2025","0","BELINYA DISINI AJA.. Bendera Jumbo Merah Putih 300 x 200 HUT RI Spanduk Dekorasi Luar ruangan Satin https://t.co/aFgUzb8QAa","1951045908470309350","","","in","","0","0","0","https://x.com/undefined/status/1951045908470309350","1890680669229178880",
"1951045722276602341","Thu Jul 31 22:22:03 +0000 2025","0","Pupuk Organik DIGROW / PUPUK CAIR ORGANIK DIGROW 1 liter Bunga Tanah Tanaman Alami https://t.co/8180GUbaay","1951045722276602341","","","in","","0","0","0","https://x.com/undefined/status/1951045722276602341","461831557",
"1951045328884605261","Thu Jul 31 22:20:29 +0000 2025","0","BELINYA DISINI.. Bendera Merah Putih Katun Tebal Bahan Katun Premium Berkualitas Ukuran 60x90cm | 80x120cm | 100x150cm https://t.co/gF3GZKUPR7","1951045328884605261","","","in","","0","0","0","https://x.com/undefined/status/1951045328884605261","1890680669229178880",
"1951044903309549805","Thu Jul 31 22:18:48 +0000 2025","0","BELI DISINI YA.. BACKGROUND KIPAS 5 GELOMBANG (4 METER) https://t.co/Tc26YJN5ED","1951044903309549805","","","in","","0","0","0","https://x.com/undefined/status/1951044903309549805","1890680669229178880",
"1951043301307515178","Thu Jul 31 22:12:26 +0000 2025","0","Rak Hijab Rak Kerudung Rak Jilbab Multifungsi/Rak Amazing Rak Sepatu 10 Tingkat Tanpa Cover Ukuran 51 x 24 x 140 cm https://t.co/dfDeyBl1QW","1951043301307515178","","","in","","0","0","0","https://x.com/undefined/status/1951043301307515178","973077666",
"1951043231803908118","Thu Jul 31 22:12:09 +0000 2025","0","Rak Hijab Rak Kerudung Rak Jilbab Multifungsi/Rak Amazing Rak Sepatu 10 Tingkat Tanpa Cover Ukuran 51 x 24 x 140 cm https://t.co/dfDeyBlzGu","1951043231803908118","","","in","","0","0","0","https://x.com/undefined/status/1951043231803908118","973077666",
"1951043225415983370","Thu Jul 31 22:12:08 +0000 2025","0","Handuk Keramas Model Kancing Topi Pita Import Microfiber Handuk Pengering Rambut Head Towel https://t.co/UftyhmBDxm","1951043225415983370","","","in","","0","0","0","https://x.com/undefined/status/1951043225415983370","973077666",
"1951041403926224953","Thu Jul 31 22:04:53 +0000 2025","0","BELINYA DISINI... TOPI RIMBA MERAH PUTIH INDONESIA TOPI KEMERDEKAAN INDONESIA TOPI HUT RI 2025 TOPI 17 AGUSTUSAN TOPI DIRGAHAYU INDONESIA https://t.co/GscSqXZOQq","1951041403926224953","","","in","","0","0","0","https://x.com/undefined/status/1951041403926224953","1890680669229178880",
"1951041204675825753","Thu Jul 31 22:04:06 +0000 2025","0","NUTRIFARM PREMIUM MATCHA POWDER 270G MATCHA BUBUK ORGANIK https://t.co/UZObNSr9Fd","1951041204675825753","","","in","","0","0","0","https://x.com/undefined/status/1951041204675825753","973077666",
"1951041161763889443","Thu Jul 31 22:03:56 +0000 2025","0","BELINYA DISINI.. Topi Pria Wanita Baseball Distro Polos NYS Bordir Brosville Jeans Casual Cap Unisex Outfit Fashion Trendy Hitam Merah https://t.co/qFKkZzk8PH","1951041161763889443","","","in","","0","0","0","https://x.com/undefined/status/1951041161763889443","1890680669229178880",
"1951041077143806095","Thu Jul 31 22:03:36 +0000 2025","1","gojek mana yak... https://t.co/2n4nbjR638","1951041077143806095","https://pbs.twimg.com/media/GxN9giaaIAMp8kg.jpg","","in","","0","0","0","https://x.com/undefined/status/1951041077143806095","1499739384685666307",
"1951040968360108509","Thu Jul 31 22:03:10 +0000 2025","0","NUTRIFARM PREMIUM MATCHA POWDER 270G MATCHA BUBUK ORGANIK https://t.co/UZObNSqBPF","1951040968360108509","","","in","","0","0","0","https://x.com/undefined/status/1951040968360108509","973077666",
"1951040447423594530","Thu Jul 31 22:01:05 +0000 2025","0","sumpah belum dapet gojek","1951040447423594530","","","in","","0","0","0","https://x.com/undefined/status/1951040447423594530","1499739384685666307",
"1951019999411446081","Thu Jul 31 20:39:50 +0000 2025","0","Judul: Konglomerat Oei Tiong Ham: Kerajaan Bisnis Pertama di Asia Tenggara Penyunting: Yoshihara Kunio Penerbit: Pustaka Utama Grafiti 1991 Tebal: viii+392 halaman Harga: Rp 100.000 - . Narahubung WA: https://t.co/e71lLJdE5O https://t.co/yRogXpmnqR https://t.co/LoWtbJNZeF https://t.co/A1Yjcz8lqN","1951019999411446081","https://pbs.twimg.com/media/GxNqV7Cb0AAUS1U.jpg","","in","","0","0","0","https://x.com/undefined/status/1951019999411446081","1771198216941490176",
"1951019610184229033","Thu Jul 31 20:38:17 +0000 2025","0","Beli 1 Gratis 1 Glamour parfume wanita wangi tahan lama https://t.co/HJudbJmmfR","1951019610184229033","","","in","","0","0","0","https://x.com/undefined/status/1951019610184229033","1801322468369698817",
"1951019280394571958","Thu Jul 31 20:36:59 +0000 2025","0","Hanasui Collagen Water Sunscreen - SPF 50 &amp; SPF 30 - Ringan &amp; Menenangkan Kulit No Whitecast Tidak Kusam Berminyak https://t.co/uJYJx3qScU","1951019280394571958","","","in","","0","0","0","https://x.com/undefined/status/1951019280394571958","256407664",
"1951019211809235179","Thu Jul 31 20:36:42 +0000 2025","0","【BIG SIZE】Hanasui Ceramide Probiotics Moisturizer Gel 100ml - Pelembab Ringan Lembap Perbaiki Skin Barrier dan Mencerahkan https://t.co/lkxE9BsAzD","1951019211809235179","","","in","","0","0","0","https://x.com/undefined/status/1951019211809235179","256407664",
"1951019164237439321","Thu Jul 31 20:36:31 +0000 2025","0","Kapsul Buah pinang muda Herbal jaya 100% Herbal original buktikan hasiatnya https://t.co/P26JGQB5Z4","1951019164237439321","","","in","","0","0","0","https://x.com/undefined/status/1951019164237439321","1801322468369698817",
"1951019081064391159","Thu Jul 31 20:36:11 +0000 2025","0","Moicare Hair Serum - Anti Hair Fall Treatment With Biotin Keratin Ginseng Chammomile Extract Mengatasi Rambut Kering &amp; Rontok Mengkilaukan Menyuburkan Menghaluskan Rambut Perawatan Haircare https://t.co/qgfobQE0Oa","1951019081064391159","","","in","","0","0","0","https://x.com/undefined/status/1951019081064391159","256407664",
"1951017502269645035","Thu Jul 31 20:32:06 +0000 2025","0","Pas gua udh naik gojek gua dipanggil temen gua MEL MATTHEW DEBUT MEL MATTHEW P03 anjir gua langsung izin ke abang gojeknya bentar mau teriak ama temen gua dulu trus gua nangis pulangnya krna ga nyangka mamat naik sejauh itu jadi p03","1951018053447328224","","byleeleo","in","","0","0","0","https://x.com/undefined/status/1951018053447328224","1888792745369878528",
"1951014615019900967","Thu Jul 31 20:18:26 +0000 2025","0","gojek pancoran lebak bulus jam 3 pagi ","1951014615019900967","","","in","","0","0","0","https://x.com/undefined/status/1951014615019900967","1054762885736390657",
"1951013823277834449","Thu Jul 31 20:15:18 +0000 2025","0","[ Fiery Sport ] Corrector Belt Penegak Punggung Women Import New Generation Terbaru Korektor Back Posture Punggung Back Strap Cross Support Punggung Anti Bungkuk Spandeks Nilon Super Quality Import Style POSTUREBELT https://t.co/G4o8wt8mOi","1951013823277834449","","","in","","0","0","0","https://x.com/undefined/status/1951013823277834449","1830802360396095488",
"1951013534386868545","Thu Jul 31 20:14:09 +0000 2025","0","Korektor Bungkuk Untuk Anak-Anak Dan Orang Dewasa Sabuk Koreksi Postur Tubuh Tak Terlihat Untuk Memperbaiki Postur Duduk Membungkuk Ke Samping Koreksi Punggung Yang Nyaman https://t.co/XUXmI8rLdB","1951013534386868545","","","in","","0","0","0","https://x.com/undefined/status/1951013534386868545","1830802360396095488",
"1951013119242936818","Thu Jul 31 20:12:30 +0000 2025","0","[N.L] PREMIUM MINISET ANAK KATUN DENGAN BUSA CUP PAD LEPAS PASANG MODEL BRALETE TANKTOP CAMISOLE ANAK KECIL PEREMPUAN CEWEAN CEWE WANITA SEKOLAH SD SMP SMA COD 5130 MINI SET BH https://t.co/qzeY68UAwv","1951013119242936818","","","in","","0","0","0","https://x.com/undefined/status/1951013119242936818","1830802360396095488",
"1951012563548041294","Thu Jul 31 20:10:17 +0000 2025","0","Sport Bra Double Layer Vest Bra Dengan Bantalan Dada Latihan Yoga Tanpa Cincin Baja Pakaian Dalam Wanita Bra 811 Olahraga https://t.co/gwoGFr7GrV","1951012563548041294","","","in","","0","0","0","https://x.com/undefined/status/1951012563548041294","1830802360396095488",
"1951005787784093955","Thu Jul 31 19:43:22 +0000 2025","0","Masker Gelatin Komedo Wajah Dear Up Mencerahkan Aging Hitam Efek Mencerahkan https://t.co/npZ8QUSAb9","1951005787784093955","","","in","","0","0","0","https://x.com/undefined/status/1951005787784093955","3288882324",
"1951003663759265835","Thu Jul 31 19:34:55 +0000 2025","0","LUXME Kemeja menutup Pita Gaya Baru Atasan Mewah Trendi https://t.co/h2h0VVxwvB","1951003663759265835","","","in","","0","0","0","https://x.com/undefined/status/1951003663759265835","1920887503286132736",
"1951003617227579599","Thu Jul 31 19:34:44 +0000 2025","0","Stevani Oneset Rok 3 in 1 Katun Tweed Premium Setelan Wanita Plus Rompi Model Terbaru https://t.co/QnfM09DCAn","1951003617227579599","","","in","","0","0","0","https://x.com/undefined/status/1951003617227579599","1920887503286132736",
"1951003564219965659","Thu Jul 31 19:34:32 +0000 2025","0","BBI Piyama wanita dewasa motif karakter animasi lucu set baju tidur perempuan lengan celana panjang full kancing bahan katun polyester terbaru kekinian murah cocok untuk harian santai fit to XXL PY008 https://t.co/nZof12NR0Q","1951003564219965659","","","in","","0","0","0","https://x.com/undefined/status/1951003564219965659","1920887503286132736",
"1951003507571695633","Thu Jul 31 19:34:18 +0000 2025","0","Kaos Crop Top Polo Shirt Wanita/Crop Top Polos/Kaos Wanita/T-shirt Kerah Polos//Kaos Crop Top Baju Atasan https://t.co/TuDCjY4zLG","1951003507571695633","","","in","","0","0","0","https://x.com/undefined/status/1951003507571695633","1920887503286132736",
"1951003461140750367","Thu Jul 31 19:34:07 +0000 2025","0","Neta Blouse Atasan Wanita Rayon Lengan Panjang Flowy// Kemeja Wanita Karet Serut Depan L XL XXL https://t.co/3AGiB5wbAx","1951003461140750367","","","in","","0","0","0","https://x.com/undefined/status/1951003461140750367","1920887503286132736",
"1951003260267221363","Thu Jul 31 19:33:19 +0000 2025","0","Coba lihat produk ini! https://t.co/rbTiVot6jy","1951003260267221363","","","in","","0","0","0","https://x.com/undefined/status/1951003260267221363","1920887503286132736",
"1951003224359706875","Thu Jul 31 19:33:11 +0000 2025","0","Coba lihat produk ini! https://t.co/C5EFp5P40a","1951003224359706875","","","in","","0","0","0","https://x.com/undefined/status/1951003224359706875","1920887503286132736",
"1951003177844875424","Thu Jul 31 19:33:00 +0000 2025","0","Piyama Set Baju Tidur BS-5002 Setelan Baju Celana Pendek Panjang Baju Rumah Cute High Quality Mimon Home https://t.co/bBYZAmXOXN","1951003177844875424","","","in","","0","0","0","https://x.com/undefined/status/1951003177844875424","1920887503286132736",
"1951002374107177476","Thu Jul 31 19:29:48 +0000 2025","0","Coba lihat produk ini! https://t.co/LJIOERQ5y1","1951002374107177476","","","in","","0","0","0","https://x.com/undefined/status/1951002374107177476","1920887503286132736",
"1950997320729759972","Thu Jul 31 19:18:00 +0000 2025","0","@gonuuk gw naik gojek lewat balai sarbini pengen lompat","1950999403231338625","","","in","","0","0","0","https://x.com/undefined/status/1950999403231338625","880344931281256448",
"1950996912385171711","Thu Jul 31 19:08:06 +0000 2025","0","Garnier Men ISI 2 Facial Foam 100 ml (Acno Fight &amp; Turbo Light) Twinpack - Sabun Cuci Muka Pria Mencerahkan Berjerawat Melembapkan Wajah Facial Cleanser https://t.co/dZvkxfzOIn","1950996912385171711","","","in","","0","0","0","https://x.com/undefined/status/1950996912385171711","1192214987558621184",
"1950996527226429603","Thu Jul 31 19:06:34 +0000 2025","0","Laushine Overnight Intense Whitening Booster Lotion Pump - New Formula Extra Shooting - 10%Niacinamide - Tranexamic Vitamin Mencerahkan Memudarkan Mengencangkan https://t.co/R0wUvXN1KN","1950996527226429603","","","in","","0","0","0","https://x.com/undefined/status/1950996527226429603","1192214987558621184",
"1950994609875853320","Thu Jul 31 18:58:57 +0000 2025","0","SKIN1004 DISKON 50RB DI TIKTOK Klaim Vouchernya di Toko Dapat Sheetmask Isi 5 https://t.co/gBv7mJVXJd https://t.co/5HLmg431pS","1950994609875853320","https://pbs.twimg.com/media/GxNTQWeaIAAs-vs.jpg","","in","","0","0","0","https://x.com/undefined/status/1950994609875853320","1926214895881654272",
"1950994419878076518","Thu Jul 31 18:58:12 +0000 2025","0","SKIN1004 DISKON 50RB DI TIKTOK Klaim Vouchernya di Toko https://t.co/WiGh1k01vA https://t.co/eNsj2rUdJU","1950994419878076518","https://pbs.twimg.com/media/GxNTFORaIAQVW49.jpg","","in","","0","0","0","https://x.com/undefined/status/1950994419878076518","1926214895881654272",
"1950994097780695233","Thu Jul 31 18:56:55 +0000 2025","0","GOJEK KU BANYAK PROMO I LOVE YOU GOJEK","1950994097780695233","","","in","","0","1","0","https://x.com/undefined/status/1950994097780695233","1300101707297222656",
"1950994005979967749","Thu Jul 31 18:56:33 +0000 2025","0","LushStep Sandal Wanita Kekinian Tali Silang Flat Shoes Wanita Korea Desain Korea Super Nyaman https://t.co/VmPLI1W7bg","1950994005979967749","","","in","","0","0","0","https://x.com/undefined/status/1950994005979967749","1192214987558621184",
"1950993305489252771","Thu Jul 31 18:53:46 +0000 2025","0","KANAZAWA Penanak Nasi Terisolasi Gula Baja Tahan Karat 304 Tutup Kaca Terlihat Kristal Keramik Glack Anti Lengket https://t.co/EBCiKYH7Tg","1950993305489252771","","","in","","0","0","0","https://x.com/undefined/status/1950993305489252771","58434309",
"1950991320493035897","Thu Jul 31 18:45:53 +0000 2025","0","Injo Eau de Parfume for Women 50ml Parfum e Inem Jogja https://t.co/w87D4hdWXk","1950991320493035897","","","in","","0","0","0","https://x.com/undefined/status/1950991320493035897","834273341678579712",
"1950991209104826781","Thu Jul 31 18:45:26 +0000 2025","0","Kaos Agustusan 8 Pcs Kaos Kemerdekaan 17 Agustus Nyaman dan Tahan Lama 8 potong set 🇮🇩 ️ https://t.co/ueg7HsXMWm #kaos #kaosagustusan #kaosseragam https://t.co/wN4l3FCVvZ","1950991209104826781","https://pbs.twimg.com/amplify_video_thumb/1950991169661591552/img/SnDBuMEp_aezO5d0.jpg","","in","","0","0","0","https://x.com/undefined/status/1950991209104826781","818710361293496321",
"1950988965659676852","Thu Jul 31 18:36:31 +0000 2025","0","Judul: Bangsa yang Belum Selesai: Indonesia Sebelum dan Sesudah Soeharto Penulis: Max Lane Penerbit: Reform Institute 2007 Tebal: xxviii+339 halaman ISBN: 9789791629003 Harga: Rp 100.000 - . Narahubung WA: https://t.co/e71lLJdE5O https://t.co/yRogXpmnqR https://t.co/LoWtbJNZeF https://t.co/9lUnlIZJZD","1950988965659676852","https://pbs.twimg.com/media/GxNOH9SaUAAF0L2.jpg","","in","","0","0","0","https://x.com/undefined/status/1950988965659676852","1771198216941490176",
"1950987842018320449","Thu Jul 31 18:32:03 +0000 2025","0","GSI Rachel Sepatu Sports Wanita Sneakers Kasual Outfit Cewek Jogging Import Terbaru Sport Senam 1294 Casual Sol Karet Shoes Olahraga Running https://t.co/FsGgpF667q","1950987842018320449","","","in","","0","0","0","https://x.com/undefined/status/1950987842018320449","410702562",
"1950987765296042445","Thu Jul 31 18:31:45 +0000 2025","0","Bawang Hitam Tunggal Premium Quality Alamme 100 Gram black garlic Spices Herbal Rempah https://t.co/McA7db9zQf","1950987765296042445","","","in","","0","0","0","https://x.com/undefined/status/1950987765296042445","410702562",
"1950987185798389805","Thu Jul 31 18:29:27 +0000 2025","2","Hukum dan sistem kenegaraan sudah dirusak 10 tahun ini https://t.co/eJrWadF5Il Tag: Prabowo amnesti Tom Lembong https://t.co/4QAVGDvqb6","1950987185798389805","https://pbs.twimg.com/ext_tw_video_thumb/1950987163535024128/pu/img/ckXk-ee3ozPPKaoh.jpg","","in","","0","0","0","https://x.com/undefined/status/1950987185798389805","1235027923834265600",
"1950986874069328126","Thu Jul 31 18:28:13 +0000 2025","0","Coba lihat produk ini! https://t.co/Fo5wmaIxmW","1950986874069328126","","","in","","0","0","0","https://x.com/undefined/status/1950986874069328126","410702562",
"1950986662802235668","Thu Jul 31 18:27:22 +0000 2025","0","Coba lihat produk ini! https://t.co/E2eMSeRA2x","1950986662802235668","","","in","","0","0","0","https://x.com/undefined/status/1950986662802235668","410702562",
"1950986607366119898","Thu Jul 31 18:27:09 +0000 2025","0","Coba lihat produk ini! https://t.co/4tbOvRt4tv","1950986607366119898","","","in","","0","0","0","https://x.com/undefined/status/1950986607366119898","160965015",
